<?xml version="1.0" encoding="UTF-8"?>
<library xmlns:xsi="http://www.w3.org/2001/XMLSchema-instance"
         xsi:noNamespaceSchemaLocation="library.xsd" name="City Library">
  <book id="b1" language="en">
    <title>The Lighthouse Keeper's Almanac</title>
    <author>Ada Vance</author>
    <year>2019</year>
    <price currency="EUR">18.50</price>
    <isbn>978-0-00-000000-2</isbn>
  </book>
  <book id="b2" language="de">
    <title>Wege durch den Nebel</title>
    <author>Jonas Weber</author>
    <author>Mira Stein</author>
    <year>2021</year>
    <price>24.00</price>
  </book>
  <book id="b3" language="fr">
    <title>Petit atlas des marées</title>
    <author>Claire Dubois</author>
    <year>2015</year>
    <price currency="EUR">12.90</price>
  </book>
</library>
